<xs:schema xmlns:xs="http://www.w3.org/2001/XMLSchema">

  <xs:element name="library">
    <xs:complexType>
      <xs:sequence>
        <xs:element name="book" maxOccurs="unbounded">
          <xs:complexType>
            <xs:sequence>
              <xs:element name="title" maxOccurs="unbounded">
                <xs:complexType>
                  <xs:simpleContent>
                    <xs:extension base="xs:string">
                      <xs:attribute name="lang" type="xs:string"/>
                    </xs:extension>
                  </xs:simpleContent>
                </xs:complexType>
              </xs:element>
              <xs:element name="author">
                <xs:complexType>
                  <xs:sequence>
                    <xs:element name="date" type="xs:date"/>
                    <xs:element name="nationality" type="xs:string"/>
                  </xs:sequence>
                </xs:complexType>
              </xs:element>
              <xs:element name="publication">
                <xs:complexType>
                  <xs:attribute name="date" type="xs:date"/>
                </xs:complexType>
              </xs:element>
            </xs:sequence>
            <xs:attribute name="isbn" type="xs:string"/>
          </xs:complexType>
        </xs:element>
        <xs:element name="description">
          <xs:complexType>
            <xs:sequence>
              <xs:element name="name" type="xs:string"/>
              <xs:element name="year" type="xs:gYear"/>
              <xs:element name="city" type="xs:string"/>
            </xs:sequence>
            <xs:attribute name="lang" type="xs:string"/>
          </xs:complexType>
        </xs:element>
      </xs:sequence>
      <xs:attribute name="nombre" type="xs:string"/>
      <xs:attribute name="nif" type="xs:string"/>
    </xs:complexType>
  </xs:element>

</xs:schema>
